<?xml version="1.0" encoding="UTF-8"?>
<!DOCTYPE unit SYSTEM "unit.dtd">
<unit xmlns="http://www.iarchives.com/schema/2002/export" collection-title="Untitled"><header-item name="volume" value="1">I</header-item><header-item name="number" value="1">1</header-item><header-item name="date" value="675867">15-JUN-1850</header-item><pages><page-ref href="pages/p001_Va_071_D45_v01.xml" /><page-ref href="pages/p002_Va_071_D45_v01.xml" /><page-ref href="pages/p003_Va_071_D45_v01.xml" /><page-ref href="pages/p004_Va_071_D45_v01.xml" /><page-ref href="pages/p005_Va_071_D45_v01.xml" /><page-ref href="pages/p006_Va_071_D45_v01.xml" /><page-ref href="pages/p007_Va_071_D45_v01.xml" /><page-ref href="pages/p008_Va_071_D45_v01.xml" /></pages><articles><article-ref href="articles/0.xml" /><article-ref href="articles/1.xml" /><article-ref href="articles/2.xml" /><article-ref href="articles/3.xml" /><article-ref href="articles/4.xml" /><article-ref href="articles/5.xml" /><article-ref href="articles/6.xml" /><article-ref href="articles/7.xml" /><article-ref href="articles/8.xml" /><article-ref href="articles/9.xml" /><article-ref href="articles/10.xml" /><article-ref href="articles/11.xml" /><article-ref href="articles/12.xml" /><article-ref href="articles/13.xml" /><article-ref href="articles/14.xml" /><article-ref href="articles/15.xml" /><article-ref href="articles/16.xml" /><article-ref href="articles/17.xml" /></articles></unit>
